Nombre,Edad,Ciudad,Vehiculo,Email,Genero,Creacion,ip_address,Universidad,Titulacion
Blancanieves,40,Corinto,Volkswagen,gireland0@europa.eu,Female,05/22/2021,Hue University of Agriculture and Forestry,Roberts-Quitzon,Associate Professor
Cenicienta,16,Bosanski Šamac,Toyota,bmcluckie1@vinaora.com,Female,12/21/2021,Morehouse College,"Predovic, Luettgen and Runolfsson",General Manager
Aurora,43,Lamalera,Lexus,ndrain2@addtoany.com,Female,09/21/2021,Universidad Católica de Santa María,Treutel and Sons,Staff Accountant IV
Ariel,26,Zhonghouhe,Ford,chendrik3@w3.org,Female,05/29/2021,Université Chrétienne du Nord d'Haiti,"Fahey, Stoltenberg and Fritsch",General Manager
Ariel,11,Hobonio,Mercury,cdudny4@1688.com,Female,07/24/2021,Matn University,Hermann Inc,Payment Adjustment Coordinator
Bella,9,Vyerkhnyadzvinsk,GMC,acartmill5@tiny.cc,Female,11/13/2021,Utsunomiya University,"Ferry, Schoen and Sauer",Sales Associate
Bella,21,Valle de Guanape,Chevrolet,tgerbel6@soundcloud.com,Female,08/09/2021,Université Mentouri Constantine,Williamson and Sons,VP Sales
Bella,4,Nîmes,MINI,mcartin7@geocities.jp,Female,11/13/2021,Radford University,Senger Inc,Information Systems Manager
Jazmin,19,Ndwedwe,Dodge,fshrimptone8@wikipedia.org,Female,12/29/2021,Universidad Motolinía del Pedegral,Pollich Group,Desktop Support Technician
Pocahontas,42,Pubal,BMW,cleroux9@behance.net,Female,12/07/2021,Benson Idahosa University,"Gibson, Erdman and Hoeger",Senior Developer
Pocahontas,41,Shetan,Ford,apridhama@ucsd.edu,Female,06/08/2021,Katholische Fachhochschule Mainz,Reynolds LLC,Account Executive
Mulan,10,Peresvet,Mitsubishi,hcooksonb@usatoday.com,Female,10/01/2021,St. Petersburg State Marine Technical University,Maggio and Sons,Professor
Mulan,47,Shun’ga,BMW,tantramc@oakley.com,Female,10/05/2021,Károl Gáspár University of the Reformed Church,Kemmer LLC,Senior Editor
Ariel,12,Solana,Mitsubishi,cyesenevd@kickstarter.com,Female,06/21/2021,Fachhochschulstudiengänge Hagenberg,"Kozey, Frami and Beatty",Senior Cost Accountant
Cenicienta,11,Cigadog,Ford,hprogere@ibm.com,Female,12/14/2021,University of Applied Sciences,Kling-Shanahan,Nurse
Maggie,9,Jinjiang,Audi,kmauchlenf@trellian.com,Female,01/14/2022,"Cleveland Chiropractic College, Los Angeles","Bartoletti, Prohaska and Wolf",Research Associate
Vera,14,Shiren,Mercury,bbuddellg@bigcartel.com,Female,09/02/2021,Blackburn College,"Parisian, Connelly and Okuneva",Statistician I
Sofia,13,Fovissste,Ram,zdonkersleyh@wix.com,Female,11/30/2021,Mountain View College,Purdy and Sons,Senior Financial Analyst
Fiora,14,Razvanje,Toyota,cmassinghami@themeforest.net,Female,09/23/2021,Sree Chitra Tirunal Institute for Medical Sciences and Technology,"Wuckert, Schumm and Gerhold",Geologist IV
Cenicienta,36,Coxim,Toyota,odenisetj@studiopress.com,Female,04/26/2021,Toho University,"Wunsch, Corwin and Kovacek",Office Assistant I
Ariel,34,Teresópolis,Pontiac,blebelk@ezinearticles.com,Female,12/21/2021,Wenzhou Medical College,Sawayn LLC,Senior Cost Accountant
Rapunzel,5,Antabamba,BMW,hcurnnokl@cargocollective.com,Female,07/10/2021,Universidad Politécnica de Cataluna,"Brakus, Moen and Reichert",Analyst Programmer
Rapuncel,17,Kuala Lumpur,Toyota,cleydonm@cbslocal.com,Female,04/13/2021,University of Illinois at Urbana-Champaign,Leffler LLC,Programmer I
Merida,25,Shakhty,BMW,tcasieron@cbsnews.com,Female,12/25/2021,Technical University of Civil Engineering Bucharest,Aufderhar Inc,Recruiting Manager
Vaina,18,San Simon,Volkswagen,tpulleyo@people.com.cn,Female,03/15/2021,Universidade de Uberaba,Kovacek Inc,Community Outreach Specialist
Anastasia,15,Dipayal,GMC,elejean6@livejournal.com,Female,02/17/2021,College of Technology at Dammam,,